1463	M	Duplo Figure Dora the Explorer, Boots The Monkey	167	16	http://www.bricklink.com/ML/1463
22447	M	Scala Doll (Marie from set 3142 with clothes)	102	\N	http://www.bricklink.com/ML/22447
23047a	M	Scala Doll (Olivia from set 3149 with clothes)	102	\N	http://www.bricklink.com/ML/23047a
23047b	M	Scala Doll (Christian from set 3149 with clothes)	102	42	http://www.bricklink.com/ML/23047b
23047c	M	Scala Doll (Baby Thomas with Large Eyes Pattern from set 3149 with clothes)	102	\N	http://www.bricklink.com/ML/23047c
23048	M	Scala Doll (Carla from set 3148 with clothes)	102	\N	http://www.bricklink.com/ML/23048
23049	M	Scala Doll (Emma 2000 restyle from set 3151 with clothes)	102	\N	http://www.bricklink.com/ML/23049
2327pb01	M	Duplo 2 x 2 x 2 Figure Brick, Blue Base, Striped Overalls, Black Hair, Big Eyes, Freckles on Nose	167	8	http://www.bricklink.com/ML/2327pb01
2327pb02	M	Duplo 2 x 2 x 2 Figure Brick, Black Base with Police Pattern, Yellow Head, Black Male Hair	167	8	http://www.bricklink.com/ML/2327pb02
2327pb03	M	Duplo 2 x 2 x 2 Figure Brick, Blue Base with Yellow Bow, Yellow Head, Red Female Hair	167	8	http://www.bricklink.com/ML/2327pb03
2327pb04	M	Duplo 2 x 2 x 2 Figure Brick, Blue Base with Sailboat Pattern, White Head with Freckles, Black Male Hair	167	8	http://www.bricklink.com/ML/2327pb04
2327pb05	M	Duplo 2 x 2 x 2 Figure Brick, Blue Base with Suspenders, White Head with Freckles on Nose, Red Male Hair	167	8	http://www.bricklink.com/ML/2327pb05
2327pb06	M	Duplo 2 x 2 x 2 Figure Brick, Green Base with White Collar and Red Heart Buttons, Yellow Head, Dark Orange Female Hair	167	9	http://www.bricklink.com/ML/2327pb06
2327pb07	M	Duplo 2 x 2 x 2 Figure Brick, Green Base with Rust Overalls and Wrench Pattern, White Head with Eyelashes, Yellow Female Hair	167	9	http://www.bricklink.com/ML/2327pb07
2327pb08	M	Duplo 2 x 2 x 2 Figure Brick, Red Base with Blue Argyle Sweater Pattern, Yellow Head with Freckles on Nose, Dark Orange Male Hair	167	8	http://www.bricklink.com/ML/2327pb08
2327pb09	M	Duplo 2 x 2 x 2 Figure Brick, Red Base with Number 1 Race Pattern, White Head, Black Male Hair	167	8	http://www.bricklink.com/ML/2327pb09
2327pb10	M	Duplo 2 x 2 x 2 Figure Brick, Yellow Base with Red Collar and Red Heart Buttons, White Head with Eyelashes, Red Female Hair	167	9	http://www.bricklink.com/ML/2327pb10
2327pb11	M	Duplo 2 x 2 x 2 Figure Brick, Grandmother, Green Base, Gray Hair, Yellow Face	167	9	http://www.bricklink.com/ML/2327pb11
2327pb12	M	Duplo 2 x 2 x 2 Figure Brick, Dog, Black Base with Collar, Black Hair with Ears, Yellow Dog face	167	10	http://www.bricklink.com/ML/2327pb12
2327pb13	M	Duplo 2 x 2 x 2 Figure Brick, Blue Base with Yellow Argyle Sweater Pattern, Yellow Head with Moustache, Light Gray Male Hair	167	10.1999998	http://www.bricklink.com/ML/2327pb13
2327pb14	M	Duplo 2 x 2 x 2 Figure Brick, Red Base with White Collar and Pink Buttons, White Head with Eyelashes, Brown Female Hair	167	9	http://www.bricklink.com/ML/2327pb14
2327pb15	M	Duplo 2 x 2 x 2 Figure Brick, Cat, Light gray base with red collar, light gray hair, white face	167	10	http://www.bricklink.com/ML/2327pb15
2327pb16	M	Duplo 2 x 2 x 2 Figure Brick, Red Base with Red Stripe Overalls, Red Hair, Big Eyes	167	9	http://www.bricklink.com/ML/2327pb16
2327pb17	M	Duplo 2 x 2 x 2 Figure Brick, Green Base with Brown Overalls, Brown Hair, White Head	167	8	http://www.bricklink.com/ML/2327pb17
2327pb18	M	Duplo 2 x 2 x 2 Figure Brick, Clown, White base, big green bow with red dots, black hair, white face with red nose	167	8	http://www.bricklink.com/ML/2327pb18
2327pb19	M	Duplo 2 x 2 x 2 Figure Brick, Clown, Blue Base with Button Suspenders, White Head, Red Male Hair	167	9	http://www.bricklink.com/ML/2327pb19
2327pb20	M	Duplo 2 x 2 x 2 Figure Brick, Blue Base with suspenders, yellow head with smile and freckles above nose, red male hair	167	8	http://www.bricklink.com/ML/2327pb20
2327pb21	M	Duplo 2 x 2 x 2 Figure Brick, Dog, Fabuland Brown Base with Yellow Scarf, Brown Hair with Ears, White Dog Face.	167	10	http://www.bricklink.com/ML/2327pb21
2327pb22	M	Duplo 2 x 2 x 2 Figure Brick, Green Base with Brown Overalls, Brown Hair, Yellow Head	167	8	http://www.bricklink.com/ML/2327pb22
2327pb23	M	Duplo 2 x 2 x 2 Figure Brick, Grandmother, Green Base, Gray Hair, White Head, Yellow Collar with Flower	167	9	http://www.bricklink.com/ML/2327pb23
2327pb24	M	Duplo 2 x 2 x 2 Figure Brick, Clown, Green Base, Yellow Collar with Green Dots, White Head, Red Hair	167	8	http://www.bricklink.com/ML/2327pb24
2327pb25	M	Duplo 2 x 2 x 2 Figure Brick, Clown, Green Base with White Collar, Yellow Head with Red Nose, Red Hair	167	8	http://www.bricklink.com/ML/2327pb25
2327pb26	M	Duplo 2 x 2 x 2 Figure Brick, Red Base with Yellow Bow, White Head with Eyelashes and Freckles, Yellow Hair	167	9	http://www.bricklink.com/ML/2327pb26
2327pb27	M	Duplo 2 x 2 x 2 Figure Brick, Black Base with Police Pattern, Yellow Head, Brown Male Hair	167	8	http://www.bricklink.com/ML/2327pb27
2327pb28	M	Duplo 2 x 2 x 2 Figure Brick, Red Base With Yellow and Red Polka Dot Scarf, White Face with Eyelashes, Black Female Hair	167	9	http://www.bricklink.com/ML/2327pb28
2327pb29	M	Duplo 2 x 2 x 2 Figure Brick, Black Base with Two Buttons, Gray Hair, White Face with Moustache	167	8	http://www.bricklink.com/ML/2327pb29
2327pb30	M	Duplo 2 x 2 x 2 Figure Brick, Dog, Fabuland Brown Base With Green Scarf, Brown Hair With Ears, Yellow Dog Face	167	10	http://www.bricklink.com/ML/2327pb30
2327pb31	M	Duplo 2 x 2 x 2 Figure Brick, Cat, Light Gray Base With Red Collar, Light Gray Hair With Ears, Yellow Face with Round Eyes and 2 Whiskers	167	10	http://www.bricklink.com/ML/2327pb31
2327pb32	M	Duplo 2 x 2 x 2 Figure Brick, Red Base With Number 1 Race Pattern, Yellow Head, Brown Male Hair	167	10.2600002	http://www.bricklink.com/ML/2327pb32
2327pb33	M	Duplo 2 x 2 x 2 Figure Brick, Black Base with Police Pattern, White Head with Moustache, Brown Male Hair	167	8	http://www.bricklink.com/ML/2327pb33
2327pb34	M	Duplo 2 x 2 x 2 Figure Brick, Dog, Black Base with Collar, Black Hair with Ears, White Dog Face	167	10	http://www.bricklink.com/ML/2327pb34
2327pb35	M	Duplo 2 x 2 x 2 Figure Brick, Red Base with Number 1 Race Pattern, White Head, Brown Male Hair	167	9	http://www.bricklink.com/ML/2327pb35
2661	M	Minnie Mouse Figure with Red Dress, Yellow Sleeves, and Red Shoes	149	11	http://www.bricklink.com/ML/2661
30564	M	Aldar Beedo (from Watto's Junkyard)	65	3.05999994	http://www.bricklink.com/ML/30564
31181pb01	M	Duplo Figure, Female Lady, Dark Pink Dress, Lace Lined Tank Top with Blue Flower	167	19	http://www.bricklink.com/ML/31181pb01
31181pb02	M	Duplo Figure, Female Lady, Red Dress, Blush, Ponytail	167	19	http://www.bricklink.com/ML/31181pb02
31181pb03	M	Duplo Figure, Female Lady, Brown Dress, Yellow Top, Black Hair (American Indian)	167	18	http://www.bricklink.com/ML/31181pb03
31181pb04	M	Duplo Figure, Female Lady, Red Dress, Yellow Top and Green Collar	167	19	http://www.bricklink.com/ML/31181pb04
31181pb05	M	Duplo Figure, Female Lady, Yellow Dress, Yellow Top, White Collar and Dark Pink Brooch	167	19.5200005	http://www.bricklink.com/ML/31181pb05
31231pb01	M	Duplo Figure Little Forest Friends, Female, Red Dress with Two White Flowers Down (Lolly Strawberry)	167	14	http://www.bricklink.com/ML/31231pb01
31231pb02	M	Duplo Figure Little Forest Friends, Female, Red Dress with Yellow Berry (Melba Strawberry)	167	14	http://www.bricklink.com/ML/31231pb02
31231pb03	M	Duplo Figure Little Forest Friends, Female, Red Hair, Red Dress with Two White Flowers Across (Sugar Strawberry)	167	13.5	http://www.bricklink.com/ML/31231pb03
31231pb04	M	Duplo Figure Little Forest Friends, Female, Green Dress with Flowers (Trixie Toadstool)	167	14	http://www.bricklink.com/ML/31231pb04
31231pb05	M	Duplo Figure Little Forest Friends, Female, Green Dress with Two Ladybugs (Grizzly Toadstool)	167	14	http://www.bricklink.com/ML/31231pb05
31232pb01	M	Duplo Figure Little Forest Friends, Male, Red Outfit with Leaves (Baby Jelly Strawberry)	167	13	http://www.bricklink.com/ML/31232pb01
31232pb02	M	Duplo Figure Little Forest Friends, Male, Red Outfit with Spiderweb (Jolly Strawberry)	167	13	http://www.bricklink.com/ML/31232pb02
31232pb03	M	Duplo Figure Little Forest Friends, Male, Green Outfit with Yellow Paw (Trouble Toadstool)	167	13	http://www.bricklink.com/ML/31232pb03
31232pb04	M	Duplo Figure Little Forest Friends, Male, Green Outfit with Acorn (Grumpy Toadstool)	167	13	http://www.bricklink.com/ML/31232pb04
31233pb01	M	Duplo Figure Little Forest Friends, Male, Medium Violet Outfit with Green Leaf (Boomer Bluebell)	167	13	http://www.bricklink.com/ML/31233pb01
31233pb02	M	Duplo Figure Little Forest Friends, Male, Medium Violet Outfit with White Flower (Toot Bluebell)	167	13	http://www.bricklink.com/ML/31233pb02
31233pb03	M	Duplo Figure Little Forest Friends, Male, White Outfit with Pine Cone (Sleepyhead Meadowsweet)	167	12	http://www.bricklink.com/ML/31233pb03
31233pb04	M	Duplo Figure Little Forest Friends, Male, White Hat and Bee on Shirt (Dozey Meadowsweet)	167	12	http://www.bricklink.com/ML/31233pb04
31234pb01	M	Duplo Figure Little Forest Friends, Female, Medium Violet Dress with Butterfly (Jangle Bluebell)	167	13	http://www.bricklink.com/ML/31234pb01
31234pb02	M	Duplo Figure Little Forest Friends, Female, Medium Violet Dress with Strawberries (Jingle Bluebell)	167	13	http://www.bricklink.com/ML/31234pb02
31234pb03	M	Duplo Figure Little Forest Friends, Female, White Dress with Three Red Berries (Dreamer Meadowsweet)	167	13	http://www.bricklink.com/ML/31234pb03
31234pb04	M	Duplo Figure Little Forest Friends, Female, White Dress with Three Red Mushrooms (Snoozy Meadowsweet)	167	14	http://www.bricklink.com/ML/31234pb04
31310pb01	M	Duplo Figure Doll, Anna Large, without Clothes	167	78	http://www.bricklink.com/ML/31310pb01
31310pb02	M	Duplo Figure Doll, Lisa Large, without Clothes	167	80	http://www.bricklink.com/ML/31310pb02
31310pb03	M	Duplo Figure Doll, Marie Large, without Clothes	167	80	http://www.bricklink.com/ML/31310pb03
31310pb04	M	Duplo Figure Doll, Sarah Large, without Clothes	167	77	http://www.bricklink.com/ML/31310pb04
31310pb05	M	Duplo Figure Doll, Sarah Large, Brown Shoes, without Clothes	167	77	http://www.bricklink.com/ML/31310pb05
31310pb06	M	Duplo Figure Doll, Anna Large, Brown Shoes, without Clothes	167	77	http://www.bricklink.com/ML/31310pb06
31312pb01	M	Duplo Figure Doll, Anna's Baby, Green Polka Dot Dress	167	9.5	http://www.bricklink.com/ML/31312pb01
31312pb02	M	Duplo Figure Doll, Lisa's Baby, Yellow Dress	167	9.5	http://www.bricklink.com/ML/31312pb02
31312pb03	M	Duplo Figure Doll, Sarah's Baby, Red Dress	167	9.5	http://www.bricklink.com/ML/31312pb03
31312pb04	M	Duplo Figure Doll, Marie's Baby, White Dress with Red Dots	167	10	http://www.bricklink.com/ML/31312pb04
33254	M	Mickey Mouse Figure with Blue Overalls, Green Sleeves, Blue Cap	149	11.6300001	http://www.bricklink.com/ML/33254
33254b	M	Mickey Mouse Figure with Blue Shirt, Red Pants (no cap)	149	9	http://www.bricklink.com/ML/33254b
33254c	M	Mickey Mouse Figure with Red Pants, Black Fireman Uniform, Black Cap	149	10	http://www.bricklink.com/ML/33254c
33261	M	Disney Pluto Dog	149	8.22000027	http://www.bricklink.com/ML/33261
41983	M	Troll - HP	227	11.8400002	http://www.bricklink.com/ML/41983
4203	M	Duplo Figure Little Robots, Stripy	167	30.6000004	http://www.bricklink.com/ML/4203
44310	M	Duplo Figure Little Robots, Tiny	167	11.5	http://www.bricklink.com/ML/44310
44383	M	Duplo Figure Little Robots, Sporty	167	25	http://www.bricklink.com/ML/44383
44732	M	Duplo Figure Little Robots, Messy	167	14.9200001	http://www.bricklink.com/ML/44732
45001	M	Duplo Figure Little Robots, Stretchy	167	20.4200001	http://www.bricklink.com/ML/45001
45219c01	M	Primo Figure Head Policeman with Helmet	294	28	http://www.bricklink.com/ML/45219c01
45219c02	M	Primo Figure Head Fireman with Helmet	294	28	http://www.bricklink.com/ML/45219c02
45219c03	M	Primo Figure Head Truck Driver with Helmet	294	28	http://www.bricklink.com/ML/45219c03
45219c04	M	Primo Figure Head Construction Worker with Helmet	294	28	http://www.bricklink.com/ML/45219c04
4534-1	M	Clikits Figure Heart - Yellow Hair, Light Green Top, Magenta Skirt	490	7.30000019	http://www.bricklink.com/ML/4534
4555pb001	M	Duplo Figure, Male Clown, Red Legs, Yellow Top with 2 Buttons, Yellow Arms, Blue Aviator Helmet	167	16	http://www.bricklink.com/ML/4555pb001
4555pb002	M	Duplo Figure, Male Clown, Red Legs, Yellow Top with 2 Buttons, Blue Arms, Red Hair Straight	167	16	http://www.bricklink.com/ML/4555pb002
4555pb003	M	Duplo Figure, Female, Light Green Legs, Yellow Blouse, Black Hair, Asian Eyes	167	17.6000004	http://www.bricklink.com/ML/4555pb003
4555pb004	M	Duplo Figure, Female, Pink Legs, White Blouse, Black Hair	167	17.6000004	http://www.bricklink.com/ML/4555pb004
4555pb005	M	Duplo Figure, Female, Yellow Legs, Dark Gray Top with Yellow Zipper and Blue Arms, Black Ponytail	167	17.8099995	http://www.bricklink.com/ML/4555pb005
4555pb006	M	Duplo Figure, Female, Blue Legs, White Top with Blue Overalls with Red Hearts	167	16	http://www.bricklink.com/ML/4555pb006
4555pb007	M	Duplo Figure, Female, White Legs, Blue Striped Top, Flesh Arms, Ponytail	167	17.7999992	http://www.bricklink.com/ML/4555pb007
4555pb008	M	Duplo Figure, Female, Yellow Legs, Red Sweater with Yellow V Stitching, Brown Hair, Turned Up Nose	167	17.6000004	http://www.bricklink.com/ML/4555pb008
4555pb008b	M	Duplo Figure, Female, Yellow Legs, Red Sweater with Yellow V Stitching, Brown Hair, Turned Down Nose	167	17.6000004	http://www.bricklink.com/ML/4555pb008b
4555pb009	M	Duplo Figure, Female, Light Green Legs, White Top with Light Green Overalls with Pink Buttons, Fabuland Brown Hair	167	16	http://www.bricklink.com/ML/4555pb009
4555pb010	M	Duplo Figure, Female, White Legs, Blue Top with Scarf and Jet Airplane, Brown Hair, Turned Down Nose (Flight Attendant)	167	17.6800003	http://www.bricklink.com/ML/4555pb010
4555pb011	M	Duplo Figure, Female, Yellow Legs, Red Blouse with White Collar, Gray Hair, Glasses, Asian Eyes	167	17.6800003	http://www.bricklink.com/ML/4555pb011
4555pb012	M	Duplo Figure, Female, Yellow Legs, Light Green Top with Heart Buttons, Gray Hair, Brown Head	167	16	http://www.bricklink.com/ML/4555pb012
4555pb013	M	Duplo Figure, Female, Red Legs, Yellow Top with Red Necklace, Gray Hair, Glasses	167	17.6000004	http://www.bricklink.com/ML/4555pb013
4555pb014	M	Duplo Figure, Female, Light Green Legs, White Blouse, Gray Hair, Glasses	167	17.6100006	http://www.bricklink.com/ML/4555pb014
4555pb015	M	Duplo Figure, Female, Blue Legs, Red Jacket, Light Gray Hair, Glasses	167	16	http://www.bricklink.com/ML/4555pb015
4555pb016	M	Duplo Figure, Female Medic, White Legs, White Top, Black Hair	167	17.6000004	http://www.bricklink.com/ML/4555pb016
4555pb017	M	Duplo Figure, Female Medic, Orange Legs, Zippered Jacket with Medic Badge	167	17.6000004	http://www.bricklink.com/ML/4555pb017
4555pb018	M	Duplo Figure, Female Police, Light Gray Legs, Yellow Hair	167	16	http://www.bricklink.com/ML/4555pb018
4555pb019	M	Duplo Figure, Female, Black Legs, Red Tie and Black Suit, Yellow Hair	167	16	http://www.bricklink.com/ML/4555pb019
4555pb020	M	Duplo Figure, Female, Red Legs, Yellow Top Unbuttoned with Red Buttons, Fabuland Brown Hair	167	17.6000004	http://www.bricklink.com/ML/4555pb020
4555pb021	M	Duplo Figure, Female, Wendy in Wallpapering Outfit	167	17.9599991	http://www.bricklink.com/ML/4555pb021
4555pb022	M	Duplo Figure, Female, Red Legs, Yellow Blouse with Red Buttons, Brown Hair	167	16	http://www.bricklink.com/ML/4555pb022
4555pb023	M	Duplo Figure, Female Zoo, Green Legs, Green Uniform, Yellow Hair (Zoo Keeper)	167	17.2299995	http://www.bricklink.com/ML/4555pb023
4555pb024	M	Duplo Figure, Male, Green Legs, Black Top, Red Scarf, Cowboy Hat (Western Bad Guy)	167	18.7900009	http://www.bricklink.com/ML/4555pb024
4555pb025	M	Duplo Figure, Male, Dark Gray Legs, Dark Gray Zippered Coat, Blue Arms, Black Hair	167	15.9300003	http://www.bricklink.com/ML/4555pb025
4555pb026	M	Duplo Figure, Male Action Wheeler, Blue Legs, Blue Jumpsuit with Parachute Straps, Black Racing Helmet	167	17.5	http://www.bricklink.com/ML/4555pb026
4555pb027	M	Duplo Figure, Male, Blue Legs, Red Top with Blue Overalls, Blue Cap, Turned Up Nose	167	16.5	http://www.bricklink.com/ML/4555pb027
4555pb028	M	Duplo Figure, Male, Blue Legs, Blue Top Plaid with Pocket, Black Hair	167	16	http://www.bricklink.com/ML/4555pb028
4555pb029	M	Duplo Figure, Male, Black Legs, Red and Blue Zippered Jacket, Blue Racing Helmet	167	17.2900009	http://www.bricklink.com/ML/4555pb029
4555pb030	M	Duplo Figure, Male, Bob the Builder	167	15.5	http://www.bricklink.com/ML/4555pb030
4555pb031	M	Duplo Figure, Male, Bob the Builder with Construction Jacket	167	15.5	http://www.bricklink.com/ML/4555pb031
4555pb032	M	Duplo Figure, Male, Blue Legs, Yellow Top with Tennis Racket and Ball Pattern, Brown Hair	167	16	http://www.bricklink.com/ML/4555pb032
4555pb033	M	Duplo Figure, Male, Blue Legs, White Two Button Cardigan, Brown Hair	167	15.5	http://www.bricklink.com/ML/4555pb033
4555pb034	M	Duplo Figure, Male, Tan Legs, Blue Zippered Jacket, Black Curly Hair, Brown Head	167	15.8999996	http://www.bricklink.com/ML/4555pb034
4555pb035	M	Duplo Figure, Male, Brown Legs, Flesh Top (Caveman)	167	16	http://www.bricklink.com/ML/4555pb035
4555pb036	M	Duplo Figure, Male, Black Legs, Red Top, Top Hat (Circus Ringmaster)	167	17.75	http://www.bricklink.com/ML/4555pb036
4555pb037	M	Duplo Figure, Male Action Wheeler, Blue Legs, Dark Gray Top with ID Badge with Belt, Yellow Cap, Sunglasses	167	16.7000008	http://www.bricklink.com/ML/4555pb037
4555pb038	M	Duplo Figure, Male, Blue Legs, Yellow Top with Black Stripes and Lego Logo, Construction Hat White	167	15.6300001	http://www.bricklink.com/ML/4555pb038
4555pb039	M	Duplo Figure, Male, Light Gray Legs, Tan Top, Cowboy Hat	167	17	http://www.bricklink.com/ML/4555pb039
4555pb040	M	Duplo Figure, Male, Red Legs, Red Top with Octan Logo, Crooked Blue Hat	167	16.7000008	http://www.bricklink.com/ML/4555pb040
4555pb041	M	Duplo Figure, Male, Orange Legs, Orange Top with Racer Zipper, Green Arms, Black Helmet	167	17.2900009	http://www.bricklink.com/ML/4555pb041
4555pb042	M	Duplo Figure, Male Action Wheeler, White Legs, White Top with Racer Red Lightning Bolt and Lines, Red Helmet with Big Eyes	167	17	http://www.bricklink.com/ML/4555pb042
4555pb043	M	Duplo Figure, Male Fireman, Black Legs, Black Top with Fire Logo and Zipper, White Fire Helmet, Moustache	167	16.3999996	http://www.bricklink.com/ML/4555pb043
4555pb044	M	Duplo Figure, Male Fireman, Black Legs, Black Top with Fire Logo and Zipper, Blue Aviator Helmet	167	16.5100002	http://www.bricklink.com/ML/4555pb044
4555pb045	M	Duplo Figure, Male Fireman, Black Legs, Black Top with Fire Logo and Zipper, White Fire Helmet	167	16	http://www.bricklink.com/ML/4555pb045
4555pb046	M	Duplo Figure, Male, White Legs, Blue Top (Airplane Jetliner Pilot)	167	15.6999998	http://www.bricklink.com/ML/4555pb046
4555pb047	M	Duplo Figure, Female, Yellow Legs, Red Top with Yellow and Red Polka Dot Scarf, Yellow Arms, Fabuland Brown Hair, without Nose	167	16	http://www.bricklink.com/ML/4555pb047
4555pb048	M	Duplo Figure, Male, Blue Legs, White Two Button Cardigan, Gray Hair, Brown Head	167	15.8999996	http://www.bricklink.com/ML/4555pb048
4555pb049	M	Duplo Figure, Male, Dark Gray Legs, Medium Blue Vest, Gray Hair, Glasses	167	15.5	http://www.bricklink.com/ML/4555pb049
4555pb050	M	Duplo Figure, Male, Black Legs, Yellow Argyle Sweater, Gray Hair, Asian Eyes	167	15.5	http://www.bricklink.com/ML/4555pb050
4555pb051	M	Duplo Figure, Male, Black Legs, Red Top with Pockets (Intelli-Train Red Conductor)	167	19.2999992	http://www.bricklink.com/ML/4555pb051
4555pb052	M	Duplo Figure, Male, Black Legs, Yellow Top with Pockets (Intelli-Train Yellow Conductor)	167	19.2999992	http://www.bricklink.com/ML/4555pb052
4555pb053	M	Duplo Figure, Male, Black Legs, White Top with 2-672 Number on Chest, Black Hair, Black Hands, Stubble (Jailbreak Joe)	167	16	http://www.bricklink.com/ML/4555pb053
4555pb054	M	Duplo Figure, Male, Dark Gray Legs, Blue Top with Gold Necklace and Belt, Moustache (King)	167	15.8599997	http://www.bricklink.com/ML/4555pb054
4555pb055	M	Duplo Figure, Male, Red Legs, Blue Top, Life Jacket, Brown Hair	167	17.6200008	http://www.bricklink.com/ML/4555pb055
4555pb056	M	Duplo Figure, Male, Dark Gray Legs, White Top with Octan Logo, Green Helmet	167	15.5500002	http://www.bricklink.com/ML/4555pb056
4555pb057	M	Duplo Figure, Male, White Legs, Blue Top with Plane Logo, Yellow Aviator Helmet, (Pilot)	167	16.8600006	http://www.bricklink.com/ML/4555pb057
4555pb058	M	Duplo Figure, Male Police, Blue Legs, Black Top with Gold Badge, Black Hat, Turned Up Nose and Round Eyes	167	15.6999998	http://www.bricklink.com/ML/4555pb058
4555pb059	M	Duplo Figure, Male Police, Dark Gray Legs, Black Top with Zipper, Tie and Badge, Brown Hair	167	14	http://www.bricklink.com/ML/4555pb059
4555pb060	M	Duplo Figure, Male Police, Dark Gray Legs, Black Top with Zipper, Tie and Badge, Blue Aviator Helmet	167	16	http://www.bricklink.com/ML/4555pb060
4555pb061	M	Duplo Figure, Male Police, Blue Legs, Black Top with 3 Buttons and Badge, Blue Hat	167	16.5699997	http://www.bricklink.com/ML/4555pb061
4555pb062	M	Duplo Figure, Male Police, Blue Legs, Black Top with 3 Buttons and Badge, Blue Aviator Helmet	167	16	http://www.bricklink.com/ML/4555pb062
4555pb063	M	Duplo Figure, Male Police, Light Gray Legs, Black Top with 3 Buttons and Badge, Blue Aviator Helmet	167	16	http://www.bricklink.com/ML/4555pb063
4555pb064	M	Duplo Figure, Male Police, Light Gray Legs, Black Top with 3 Buttons and Badge, White Racing Helmet	167	17	http://www.bricklink.com/ML/4555pb064
4555pb065	M	Duplo Figure, Male, Red Legs, Red Top with Cat Eye Racer Logo, Blue Helmet	167	17.3099995	http://www.bricklink.com/ML/4555pb065
4555pb066	M	Duplo Figure, Male, White Legs, White Top with Black Zipper and Racer #1, Yellow Aviator Helmet	167	16.3999996	http://www.bricklink.com/ML/4555pb066
4555pb067	M	Duplo Figure, Male, Black Legs, Black Top with White Zipper and Racer #1, Yellow Helmet with Black Stripes	167	17.2399998	http://www.bricklink.com/ML/4555pb067
4555pb068	M	Duplo Figure, Male, White Legs, White Top with Black Zipper and Racer #2, Green Helmet	167	17.6000004	http://www.bricklink.com/ML/4555pb068
4555pb069	M	Duplo Figure, Male, White Legs, White Top with Black Zipper and Racer #2, Red Aviator Helmet	167	16.3799992	http://www.bricklink.com/ML/4555pb069
4555pb070	M	Duplo Figure, Male, Red Legs, Red Top with Black Zipper and Racer #2, White Helmet with Checkered Stripe	167	17.4599991	http://www.bricklink.com/ML/4555pb070
4555pb071	M	Duplo Figure, Male, Green Legs, Red Top Plaid, Brown Cap	167	16.5	http://www.bricklink.com/ML/4555pb071
4555pb072	M	Duplo Figure, Female, Black Legs, Dark Gray Top with Blue Patches, Black Hair, Wart on Nose, Tooth	167	17.5599995	http://www.bricklink.com/ML/4555pb072
4555pb073	M	Duplo Figure, Male, Dark Gray Legs, Tan Top, Pith Helmet, Moustache	167	17.3999996	http://www.bricklink.com/ML/4555pb073
4555pb074	M	Duplo Figure, Male, Dark Gray Legs, White Top with Blue Vest with Pocket and Two Buttons, Black Top Hat	167	17.75	http://www.bricklink.com/ML/4555pb074
4555pb075	M	Duplo Figure, Male, Black Legs, Black Top with 4 Yellow Buttons and Red Tie, Black Hat, Curly Moustache (Train Engineer)	167	16.3600006	http://www.bricklink.com/ML/4555pb075
4555pb076	M	Duplo Figure, Male, Blue Legs, Red Top with Blue Overalls, Construction Hat White, Turned Up Nose	167	15.6000004	http://www.bricklink.com/ML/4555pb076
4555pb077	M	Duplo Figure, Female, Red Legs, Yellow Top with Red Buttons & Wrench in Pocket, Construction Hat White	167	15.6000004	http://www.bricklink.com/ML/4555pb077
4555pb078	M	Duplo Figure, Male, Green Legs, Yellow Top with Green Overalls, Red Cap (Zoo Keeper)	167	16.4400005	http://www.bricklink.com/ML/4555pb078
4555pb079	M	Duplo Figure, Male, Green Legs, Green Top, Yellow Cap (Zoo Keeper)	167	16.1700001	http://www.bricklink.com/ML/4555pb079
4555pb080	M	Duplo Figure, Male, Brown Legs, Flesh Top with White Stripes (American Indian Chief)	167	21.0100002	http://www.bricklink.com/ML/4555pb080
4555pb081	M	Duplo Figure, Male, Blue Legs, Blue Top with Cell Phone in Pocket, Construction Hat Orange	167	15.6000004	http://www.bricklink.com/ML/4555pb081
4555pb082	M	Duplo Figure, Male, Naughty Spud (Bob the Builder)	167	15.6000004	http://www.bricklink.com/ML/4555pb082
4555pb083	M	Duplo Figure, Male, Yellow Legs, Yellow Top with Green Racer Suspenders, Black Helmet with Stripes and Bear Pattern	167	17.3199997	http://www.bricklink.com/ML/4555pb083
4555pb084	M	Duplo Figure, Female, Medium Green Legs, Yellow Blouse with Collar, Gray Hair, Glasses	167	17.8799992	http://www.bricklink.com/ML/4555pb084
4555pb085	M	Duplo Figure, Female Clown, Red Legs, Red Hair	167	17.6000004	http://www.bricklink.com/ML/4555pb085
4555pb086	M	Duplo Figure, Male, Blue Legs, Yellow Top, Brown Cap, with White in Eyes Pattern	167	16.1000004	http://www.bricklink.com/ML/4555pb086
4555pb086a	M	Duplo Figure, Male, Blue Legs, Yellow Top, Brown Cap, no White in Eyes Pattern	167	16.5	http://www.bricklink.com/ML/4555pb086a
4555pb087	M	Duplo Figure, Male, Blue Legs, Red Top Plaid, White Cowboy Hat	167	17	http://www.bricklink.com/ML/4555pb087
4555pb088	M	Duplo Figure, Male, Light Gray Legs, Blue Top with Red Bandana, Black Cowboy Hat	167	17.1299992	http://www.bricklink.com/ML/4555pb088
4555pb089	M	Duplo Figure, Female, Red Legs, Blue Blouse with White Lace Trim, Brown Hair	167	17	http://www.bricklink.com/ML/4555pb089
4555pb090	M	Duplo Figure, Male Police, Dark Gray Legs, Black Top with Zipper, Tie and Badge, Blue Cap	167	16.7000008	http://www.bricklink.com/ML/4555pb090
