firec006	M	Fire - Flame Badge and Straight Line, Black Legs, White Fire Helmet	67	4	http://www.bricklink.com/ML/firec006
firec007	M	Fire - Air Gauge and Pocket, Light Gray Legs, White Fire Helmet	67	3.48000002	http://www.bricklink.com/ML/firec007
firec008	M	Fire - Classic, Black Hat, Captain	67	3.4000001	http://www.bricklink.com/ML/firec008
firec009	M	Fire - Flame Badge and 2 Buttons, Black Legs, White Fire Helmet with Fire Logo	67	4	http://www.bricklink.com/ML/firec009
firec010	M	Fire - Flame Badge and Straight Line, Black Legs, White Helmet, Trans-Light Blue Visor	67	3.70000005	http://www.bricklink.com/ML/firec010
firec011	M	Fire - Air Gauge and Pocket, Light Gray Legs, Black Fire Helmet	67	4.65999985	http://www.bricklink.com/ML/firec011
firec012	M	Fire - Flame Badge and Straight Line, Light Gray Legs, Brown Ponytail Hair	67	3.56999993	http://www.bricklink.com/ML/firec012
firec013	M	Fire - Air Gauge and Pocket, Light Gray Legs, Moustache, Black Helmet, Trans-Light Blue Visor (Set 6554)	67	3.68000007	http://www.bricklink.com/ML/firec013
firec014	M	Fire - City Center 5, Light Gray Legs with Black Hips, White Fire Helmet, Airtanks	67	5	http://www.bricklink.com/ML/firec014
firec015	M	Fire - Flame Badge and 2 Buttons, Black Legs, White Fire Helmet, Life Jacket	67	4.13999987	http://www.bricklink.com/ML/firec015
firec016	M	Fire - Classic, White Construction Helmet	67	3.38000011	http://www.bricklink.com/ML/firec016
firec017	M	Fire - Flame Badge and 2 Buttons, Black Legs, White Fire Helmet	67	3.41000009	http://www.bricklink.com/ML/firec017
firec018	M	Fire - Classic, White Fire Helmet, White Airtanks	67	4	http://www.bricklink.com/ML/firec018
firec019	M	Fire - Old, Black Fire Helmet, Light Gray Airtanks	67	4	http://www.bricklink.com/ML/firec019
firec019s	M	Fire - Old Stickered Torso, Black Fire Helmet, Light Gray Airtanks	67	4	http://www.bricklink.com/ML/firec019s
firec020	M	Fire - Flame Badge and Straight Line, Black Legs, Black Male Hair	67	3.3599999	http://www.bricklink.com/ML/firec020
firec021	M	Fire - Flame Badge and 2 Buttons, Light Bluish Gray Legs, White Fire Helmet	67	3.44000006	http://www.bricklink.com/ML/firec021
firec022	M	Fire - Flame Badge and 2 Buttons, Black Legs, White Fire Helmet, Black Legs, Smile	67	3.5999999	http://www.bricklink.com/ML/firec022
firec023	M	Fire - Flame Badge and 2 Buttons, Black Legs, Black Male Hair	67	3.3599999	http://www.bricklink.com/ML/firec023
firec024	M	Fire - Classic, Black Fire Helmet, Light Gray Airtanks	67	4	http://www.bricklink.com/ML/firec024
firec025	M	Fire - Flame Badge and Straight Line, Black Legs, White Fire Helmet, Life Jacket	67	4.13999987	http://www.bricklink.com/ML/firec025
firec026	M	Fire - Air Gauge and Pocket, Light Gray Legs, White Fire Helmet, Life Jacket	67	4.13999987	http://www.bricklink.com/ML/firec026
firec027	M	Fire - Air Gauge and Pocket, Light Gray Legs, White Fire Helmet, Breathing Hose, Yellow Airtanks	67	4.65999985	http://www.bricklink.com/ML/firec027
firec028	M	Fire - Old, White Fire Helmet, White Airtanks	67	4	http://www.bricklink.com/ML/firec028
fmf001	M	Plain White Torso with White Arms, Red Legs, Black Female Hair	67	3.32999992	http://www.bricklink.com/ML/fmf001
fmf002	M	Plain Blue Torso with Blue Arms, White Legs, Black Pigtails Hair	67	3.25999999	http://www.bricklink.com/ML/fmf002
fre001	M	Freestyle Timmy with Green Legs and Red Hat	78	3.36999989	http://www.bricklink.com/ML/fre001
fre002	M	Freestyle Timmy with Black Legs and Green Wizard Hat	78	4.32999992	http://www.bricklink.com/ML/fre002
fre003	M	Plain Dark Pink Torso with White Arms, Pink Legs, Black Ponytail Hair	78	3.56999993	http://www.bricklink.com/ML/fre003
fre004	M	Horizontal Blue/White Stripes, Light Gray Legs, Black Male Hair	78	3.25	http://www.bricklink.com/ML/fre004
fre005	M	Surfboard on Ocean - Blue Legs, Black Hair Male, Moustache (4151)	78	3.26999998	http://www.bricklink.com/ML/fre005
fre006	M	TV Logo Small Pattern, Green Legs, Brown Ponytail Hair	78	3.5	http://www.bricklink.com/ML/fre006
frnd001	M	Friends Emma, Magenta Layered Skirt, Medium Violet Top	771	3.5999999	http://www.bricklink.com/ML/frnd001
frnd002	M	Friends Stephanie, Medium Lavender Skirt, White Top	771	3.5999999	http://www.bricklink.com/ML/frnd002
frnd003	M	Friends Stephanie, Bright Pink Skirt, Light Aqua Long Sleeve Top	771	3.53999996	http://www.bricklink.com/ML/frnd003
frnd004	M	Friends Andrea, White Cropped Trousers, Lime Halter Neck Top	771	3.5999999	http://www.bricklink.com/ML/frnd004
frnd005	M	Friends Mia, Dark Blue Layered Skirt, Light Aqua Halter Neck Top	771	3.70000005	http://www.bricklink.com/ML/frnd005
frnd006	M	Friends Olivia, Lime Cropped Trousers, Orange Top	771	3.4000001	http://www.bricklink.com/ML/frnd006
frnd007	M	Friends Emma, Dark Blue Layered Skirt, Medium Violet Top, White Boots	771	3.5999999	http://www.bricklink.com/ML/frnd007
frnd008	M	Friends Stephanie, Magenta Layered Skirt, White Top	771	3.47000003	http://www.bricklink.com/ML/frnd008
frnd009	M	Friends Mia, Medium Lavender Skirt, Light Blue Top	771	3.5999999	http://www.bricklink.com/ML/frnd009
frnd010	M	Friends Olivia, Dark Blue Layered Skirt, Dark Pink Top	771	3.5999999	http://www.bricklink.com/ML/frnd010
frnd011	M	Friends Emma, Dark Blue Layered Skirt, Medium Lavender Top	771	3.5999999	http://www.bricklink.com/ML/frnd011
frnd012	M	Friends Sarah, Light Aqua Layered Skirt, White Top	771	3.5999999	http://www.bricklink.com/ML/frnd012
frnd013	M	Friends Marie, Bright Pink Skirt, Bright Pink Sleeveless Blouse Top	771	3.70000005	http://www.bricklink.com/ML/frnd013
frnd014	M	Friends Andrea, Light Aqua Layered Skirt, Bright Light Orange Top	771	3.5	http://www.bricklink.com/ML/frnd014
frnd015	M	Friends Sophie, Bright Pink Layered Skirt, Light Aqua Long Sleeve Blouse Top	771	3.70000005	http://www.bricklink.com/ML/frnd015
frnd016	M	Friends Mia, Lime Cropped Trousers, Light Blue Top	771	3.5999999	http://www.bricklink.com/ML/frnd016
frnd017	M	Friends Olivia, Medium Lavender Skirt, Dark Pink Top	771	3.5999999	http://www.bricklink.com/ML/frnd017
frnd018	M	Friends Anna, Red Long Skirt, Dark Blue Sleeveless Blouse Top	771	3.3499999	http://www.bricklink.com/ML/frnd018
frnd019	M	Friends Peter, Dark Blue Trousers, White Shirt and Red Tie, Dark Tan Shoes	771	3.3499999	http://www.bricklink.com/ML/frnd019
frnd020	M	Friends Katharina, Black Riding Jacket and Hat	771	3.55999994	http://www.bricklink.com/ML/frnd020
frnd021	M	Friends Nicole, Light Aqua Layered Skirt, Light Yellow Top	771	3.5999999	http://www.bricklink.com/ML/frnd021
frnd022	M	Friends Mia, Bright Pink Skirt, Light Aqua Halter Neck Top	771	3.20000005	http://www.bricklink.com/ML/frnd022
frnd023	M	Friends Olivia, Bright Pink Layered Skirt, Orange Top	771	3.5999999	http://www.bricklink.com/ML/frnd023
frnd024	M	Friends Andrea, Light Aqua Layered Skirt, Lime Halter Neck Top	771	3.3499999	http://www.bricklink.com/ML/frnd024
frnd025	M	Friends Theresa, White Riding Pants, Light Aqua Top with Collar	771	3.5999999	http://www.bricklink.com/ML/frnd025
frnd026	M	Friends Ella, White Cropped Trousers, Magenta Top	771	3.5999999	http://www.bricklink.com/ML/frnd026
frnd027	M	Friends Emma, White Riding Pants, Medium Violet Top	771	3.5999999	http://www.bricklink.com/ML/frnd027
frnd028	M	Friends Stephanie, Lime Cropped Trousers, White Top	771	3.5999999	http://www.bricklink.com/ML/frnd028
frnd029	M	Friends Christina, Red Skirt and Leggings, Red Long Sleeve Christmas Top	771	3.5999999	http://www.bricklink.com/ML/frnd029
frnd030	M	Friends Olivia, Dark Blue Layered Skirt, Light Aqua Long Sleeve Christmas Top	771	3.5999999	http://www.bricklink.com/ML/frnd030
frnd031	M	Friends Chloe, Light Aqua Layered Skirt, White Top	771	3.5999999	http://www.bricklink.com/ML/frnd031
frnd032	M	Friends Andrea, Bright Light Yellow Shorts, Dark Azure Bikini Top	771	3.3900001	http://www.bricklink.com/ML/frnd032
frnd033	M	Friends Isabella, Magenta Wrap Skirt, Lime Bikini Top	771	3.24000001	http://www.bricklink.com/ML/frnd033
frnd034	M	Friends Emma, Bright Pink Skirt, Dark Blue Top	771	\N	http://www.bricklink.com/ML/frnd034
frnd035	M	Friends Joanna, Magenta Cropped Trousers, Orange Top	771	\N	http://www.bricklink.com/ML/frnd035
frnd036	M	Friends Stephanie, Dark Blue Cropped Trousers, White Soccer Jersey	771	3.45000005	http://www.bricklink.com/ML/frnd036
frnd037	M	Friends Emma, White Karate Uniform, Bow	771	3.24000001	http://www.bricklink.com/ML/frnd037
frnd038	M	Friends Stephanie, Lavender Skirt, White Top with Star Belt, Gold Tiara	771	3.48000002	http://www.bricklink.com/ML/frnd038
frnd039	M	Friends Kate, Medium Azure Shorts, Striped Bikini Top	771	3.4000001	http://www.bricklink.com/ML/frnd039
frnd040	M	Friends Olivia, Bright Light Blue Skirt, Magenta Top	771	3.48000002	http://www.bricklink.com/ML/frnd040
frnd041	M	Friends Mia, Black Trousers, Black Formal Jacket with Bow Tie	771	3.5999999	http://www.bricklink.com/ML/frnd041
frnd042	M	Friends Stephanie, Dark Purple Skirt, Magenta Top with White Jacket	771	\N	http://www.bricklink.com/ML/frnd042
frnd043	M	Friends Matthew, Dark Blue Trousers, Bright Green Polo Shirt	771	\N	http://www.bricklink.com/ML/frnd043
frnd044	M	Friends Ms. Stevens, White Long Skirt, Medium Lavender Vest	771	\N	http://www.bricklink.com/ML/frnd044
frnd045	M	Friends Mia, Bright Light Blue Skirt, Medium Green Top with White Stripes	771	\N	http://www.bricklink.com/ML/frnd045
frnd046	M	Friends Maya, Magenta Wrap Skirt, White Top	771	\N	http://www.bricklink.com/ML/frnd046
frnd047	M	Friends Andrew, Dark Blue Cropped Trousers, Bright Light Blue Polo Shirt	771	\N	http://www.bricklink.com/ML/frnd047
fst001	M	FIRST LEGO League 1999 pattern	545	2.95000005	http://www.bricklink.com/ML/fst001
fst002	M	FIRST LEGO League Y2K pattern	545	2.95000005	http://www.bricklink.com/ML/fst002
fst003	M	FIRST LEGO League Climate Connections Scientist 1	545	3.58999991	http://www.bricklink.com/ML/fst003
fst004	M	FIRST LEGO League Climate Connections Scientist 2	545	3.5	http://www.bricklink.com/ML/fst004
fst005	M	FIRST LEGO League Climate Connections Scientist 3	545	3.29999995	http://www.bricklink.com/ML/fst005
fst006	M	FIRST LEGO League Climate Connections Scientist 4	545	3.3599999	http://www.bricklink.com/ML/fst006
fst007	M	FIRST LEGO League Climate Connections Scientist 5	545	3.3599999	http://www.bricklink.com/ML/fst007
fst008	M	FIRST LEGO League Climate Connections Scientist 6	545	3.99000001	http://www.bricklink.com/ML/fst008
fst009	M	FIRST LEGO League Climate Connections Boy	545	3.72000003	http://www.bricklink.com/ML/fst009
fst010	M	FIRST LEGO League Climate Connections Girl	545	3.99000001	http://www.bricklink.com/ML/fst010
fst011	M	FIRST LEGO League Climate Connections Skier Male White Top, Brown Helmet	545	4.61000013	http://www.bricklink.com/ML/fst011
fst012	M	FIRST LEGO League Climate Connections Skier Female White Top, Black Helmet	545	4.61000013	http://www.bricklink.com/ML/fst012
fst013	M	FIRST LEGO League Climate Connections Skier Male Black Top, Black Helmet	545	4.61000013	http://www.bricklink.com/ML/fst013
fst014	M	FIRST LEGO League Climate Connections Skier Female Black Top, Brown Helmet	545	4.61000013	http://www.bricklink.com/ML/fst014
fst015	M	FIRST LEGO League Nano Quest Space Elevator Passenger	545	3.67000008	http://www.bricklink.com/ML/fst015
game001	M	Leather Jacket with Zippers - Black Legs, Skeleton Head, Black Top Hat, White Hands	252	3.63000011	http://www.bricklink.com/ML/game001
game002	M	Jacket Green with 2 Large Pockets - Green Legs, No Headgear (Green Cruiser)	252	2.97000003	http://www.bricklink.com/ML/game002
game003	M	Jacket Brown - Brown Legs, No Headgear (Brown Cruiser)	252	2.97000003	http://www.bricklink.com/ML/game003
game004	M	Jacket Blue - Blue Legs, No Headgear (Blue Cruiser)	252	3.06999993	http://www.bricklink.com/ML/game004
game005	M	Jacket 2 Stars Red - Red Legs, No Headgear (Red Cruiser)	252	2.97000003	http://www.bricklink.com/ML/game005
game006	M	Medium Blue Jacket, Black Legs, Black Mid-Length Female Hair (from GA08539)	67	3.92000008	http://www.bricklink.com/ML/game006
game007	M	Dark Blue Jacket, Light Blue Shirt, White Legs, Square Glasses, Brown Male Hair (from GA08539)	67	3.3599999	http://www.bricklink.com/ML/game007
game008	M	Plain Red Torso with Red Arms, Blue Legs, Dark Brown Short Tousled Hair	67	3.4000001	http://www.bricklink.com/ML/game008
gen001	M	Skeleton with Standard Skull	143	2	http://www.bricklink.com/ML/gen001
gen002	M	Ghost with 1 x 2 Plate and 1 x 2 Brick as Legs	143	5.9000001	http://www.bricklink.com/ML/gen002
gen003	M	Quicky the Nesquik Bunny (Nestle Rabbit)	143	4.0999999	http://www.bricklink.com/ML/gen003
gen004	M	Skeleton with Evil Skull	143	2	http://www.bricklink.com/ML/gen004
gen005	M	Skeleton with Standard Skull, Blue Wizard Hat, Bandana	143	4	http://www.bricklink.com/ML/gen005
gen006	M	Skeleton with Standard Skull, Yellow Mummy Headdress with Pattern	143	3	http://www.bricklink.com/ML/gen006
gen007	M	Skeleton with Standard Skull, White Mummy Headdress	143	2.8499999	http://www.bricklink.com/ML/gen007
gen008	M	Skeleton with Standard Skull, Yellow Mummy Headdress	143	2.86999989	http://www.bricklink.com/ML/gen008
gen009	M	Skeleton with Standard Skull, Black Neck Protector Helmet	143	2	http://www.bricklink.com/ML/gen009
gen010	M	Skeleton with Standard Skull, Red Bandana	143	2	http://www.bricklink.com/ML/gen010
gen011	M	Skeleton with Standard Skull, Black Conquistador Helmet	143	3	http://www.bricklink.com/ML/gen011
gen012	M	Ghost with White Legs	143	6	http://www.bricklink.com/ML/gen012
gen013	M	Skeleton Black with Evil Skull	143	2	http://www.bricklink.com/ML/gen013
gen014	M	Skeleton Sand Green with Black Legs and Black Head with Evil Skull	143	2	http://www.bricklink.com/ML/gen014
gen015	M	De Bouwsteen Legoworld 2005 Minifig	143	3	http://www.bricklink.com/ML/gen015
gen016	M	Skeleton with Evil Skull, Black Aquaraiders II Helmet (Squid Victim)	143	2.70000005	http://www.bricklink.com/ML/gen016
gen017	M	Skeleton with Evil Skull, Crown	143	3	http://www.bricklink.com/ML/gen017
gen018	M	Skeleton, Fantasy Era Torso with Evil Skull	143	2	http://www.bricklink.com/ML/gen018
gen019	M	Skeleton, Fantasy Era Torso with Standard Skull, Mechanical Arms Straight	143	2	http://www.bricklink.com/ML/gen019
gen020	M	Skeleton with Evil Skull, Bicorne Hat	143	3.20000005	http://www.bricklink.com/ML/gen020
gen021	M	Skeleton, Fantasy Era Torso with Evil Skull, Black Conquistador Helmet, Pearl Light Gray Armor	143	3.31999993	http://www.bricklink.com/ML/gen021
gen021a	M	Skeleton, Fantasy Era Torso with Evil Skull, Black Conquistador Helmet, Metallic Silver Armor	143	3.3499999	http://www.bricklink.com/ML/gen021a
gen022	M	Ghost with White Legs, Yellow Hands	143	6	http://www.bricklink.com/ML/gen022
gen023	M	Lego 50 Year Anniversary Minifig	143	3.5	http://www.bricklink.com/ML/gen023
gen024	M	Surfboard on Ocean - Reddish Brown Legs, Red Cap	67	3.36999989	http://www.bricklink.com/ML/gen024
gen025	M	Plain Red Torso with Red Arms, Blue Legs (Lego Universe Bob)	67	3	http://www.bricklink.com/ML/gen025
gen026	M	Skeleton with Fantasy Era Skull, Bicorne Hat	143	2.5999999	http://www.bricklink.com/ML/gen026
gen027	M	Skeleton with Standard Skull, Top Hat	143	2.56999993	http://www.bricklink.com/ML/gen027
gen028	M	LEGO Fan Weekend 2009 Minifig	143	3.5	http://www.bricklink.com/ML/gen028
gen029	M	LEGO Club Max	143	3.49000001	http://www.bricklink.com/ML/gen029
gen030	M	LEGO Universe Nexus Astronaut	755	3.6099999	http://www.bricklink.com/ML/gen030
gen031	M	Skeleton with Standard Skull, Black Aquaraiders II Helmet	143	2.70000005	http://www.bricklink.com/ML/gen031
gen033	M	Birthday Party Minifig	143	3.55999994	http://www.bricklink.com/ML/gen033
gen034	M	LEGO Fan Weekend 2010 Minifig	143	3	http://www.bricklink.com/ML/gen034
gen035	M	Skeleton with Round Brick Head (Ninjago Bowling Pin)	143	2.20000005	http://www.bricklink.com/ML/gen035
gen036	M	Skeleton, Fantasy Era Torso with Standard Skull, Mechanical Arms, Red Bandana (9349)	143	2.5	http://www.bricklink.com/ML/gen036
gen037	M	Skeleton, Fantasy Era Torso with Standard Skull, Mechanical Arms, Black Bicorne Hat, Red Plume (9349)	143	2.79999995	http://www.bricklink.com/ML/gen037
gen038	M	Skeleton, Fantasy Era Torso with Standard Skull, Mechanical Arms Bent	143	2.07999992	http://www.bricklink.com/ML/gen038
gen039	M	LEGO KidsFest 2010 Minifig	143	3.29999995	http://www.bricklink.com/ML/gen039
gen040	M	LEGO Fan Weekend 2011 Minifig	143	3	http://www.bricklink.com/ML/gen040
gen041	M	De Bouwsteen Legoworld 2008 Minifig	143	4.07000017	http://www.bricklink.com/ML/gen041
gen042	M	LEGO Idea House Minifig	143	\N	http://www.bricklink.com/ML/gen042
gen043	M	Ghost with Pointed Top Shroud	143	6.0999999	http://www.bricklink.com/ML/gen043
gen044	M	Ghost with Pointed Top Shroud and Ball and Chain	143	6.5999999	http://www.bricklink.com/ML/gen044
gen045	M	Hayabusa Project Manager - J. Kawaguchi	143	3.38000011	http://www.bricklink.com/ML/gen045
gen046	M	Ghost with Pointed Top Shroud with 1x2 Plate and 1x2 Brick as Legs	143	6	http://www.bricklink.com/ML/gen046
gen047	M	Skeleton with Standard Skull, Bent Arms	143	2.18000007	http://www.bricklink.com/ML/gen047
gen048	M	BR LEGO Minifigure	143	4	http://www.bricklink.com/ML/gen048
gg001	M	Skateboarder, Red Shirt with Silver Logos, Dark Blue Legs	473	3.4000001	http://www.bricklink.com/ML/gg001
gg002	M	Snowboarder, Dark Gray Shirt, Dark Blue Legs, White Vest	473	4	http://www.bricklink.com/ML/gg002
gg003	M	Skateboarder, Dark Blue Shirt, Tan Legs	473	3.4000001	http://www.bricklink.com/ML/gg003
gg004	M	Skateboarder, Medium Blue Shirt, Dark Blue Legs	473	3.4000001	http://www.bricklink.com/ML/gg004
gg005	M	Snowboarder, Red Shirt, Dark Gray Legs, White Vest	473	4	http://www.bricklink.com/ML/gg005
gg006	M	Snowboarder, Blue Shirt, Tan Legs, White Vest	473	4	http://www.bricklink.com/ML/gg006
gg007	M	Skateboarder, Black Shirt, Light Gray Legs, with Back Stud	473	3.33999991	http://www.bricklink.com/ML/gg007
gg008	M	Snowboarder, Red Shirt, Black Legs, White Vest	473	4	http://www.bricklink.com/ML/gg008
gg009	M	Snowboarder, Dark Gray Shirt, Black Legs, Black Helmet, White Vest	473	4	http://www.bricklink.com/ML/gg009
gg010	M	Skateboarder, Black Shirt, Light Gray Legs, without Back Stud	473	3.28999996	http://www.bricklink.com/ML/gg010
gg019a	M	Skateboarder, Black Jacket, Medium Orange Legs - with Neck Bracket	473	3.56999993	http://www.bricklink.com/ML/gg019a
gs001	M	Alien Buggoid, Olive Green	34	4.1500001	http://www.bricklink.com/ML/gs001
gs002	M	Dark Azure Robot Sidekick with Jet Pack	34	4.96000004	http://www.bricklink.com/ML/gs002
gs003	M	Winged Mosquitoid	34	4.01000023	http://www.bricklink.com/ML/gs003
gs004	M	Solomon Blaze	34	4.07000017	http://www.bricklink.com/ML/gs004
gs005	M	Billy Starbeam	34	4.11999989	http://www.bricklink.com/ML/gs005
gs006	M	Red Robot Sidekick with Jet Pack	34	\N	http://www.bricklink.com/ML/gs006
gs007	M	Dark Azure Robot Sidekick	34	3.31999993	http://www.bricklink.com/ML/gs007
gs008	M	Alien Buggoid, Dark Red	34	4.15999985	http://www.bricklink.com/ML/gs008
gs009	M	Chuck Stonebreaker	34	4.11999989	http://www.bricklink.com/ML/gs009
gs010	M	Orange Robot Sidekick	34	\N	http://www.bricklink.com/ML/gs010
gs011	M	Jack Fireblade	34	4.11999989	http://www.bricklink.com/ML/gs011
gs012	M	Ashlee Starstrider	34	4.11999989	http://www.bricklink.com/ML/gs012
gs013	M	Bright Green Robot Sidekick with Armor	34	\N	http://www.bricklink.com/ML/gs013
gs014	M	Mantizoid	34	4.96999979	http://www.bricklink.com/ML/gs014
hgh001	M	Highway Pattern - Light Gray Legs, Red Cap	67	3.36999989	http://www.bricklink.com/ML/hgh001
hgh002	M	Highway Pattern - Blue Legs, White Hat	67	3.4000001	http://www.bricklink.com/ML/hgh002
hgh003	M	Highway Pattern - Blue Legs, White Cap	67	3.36999989	http://www.bricklink.com/ML/hgh003
hgh004	M	Highway Pattern - Blue Legs, Red Cap	67	3.36999989	http://www.bricklink.com/ML/hgh004
hgh005	M	Highway Pattern - Blue Legs, Red Construction Helmet	67	3.38000011	http://www.bricklink.com/ML/hgh005
hgh008	M	Highway Pattern - Green Legs, Red Construction Helmet	67	3.26999998	http://www.bricklink.com/ML/hgh008
hgh009	M	Highway Pattern - Light Gray Legs, Black Hat	67	3.38000011	http://www.bricklink.com/ML/hgh009
hgh010	M	Highway Pattern - Black Legs, Red Construction Helmet	67	3.26999998	http://www.bricklink.com/ML/hgh010
hky001	M	Hockey Player A	473	4.57999992	http://www.bricklink.com/ML/hky001
hky002	M	Hockey Player B	473	4.57999992	http://www.bricklink.com/ML/hky002
hky003	M	Hockey Player C	473	4.57999992	http://www.bricklink.com/ML/hky003
hky004	M	Hockey Player D	473	4.57999992	http://www.bricklink.com/ML/hky004
hky005	M	Hockey Player E	473	4.57999992	http://www.bricklink.com/ML/hky005
hky006	M	Hockey Player F	473	4.57999992	http://www.bricklink.com/ML/hky006
hky007	M	Hockey Player G	473	4.57999992	http://www.bricklink.com/ML/hky007
hky008	M	Hockey Player H	473	4.57999992	http://www.bricklink.com/ML/hky008
hky009	M	Street Hockey Player, Dark Blue Torso, Dark Orange Legs	473	3.32999992	http://www.bricklink.com/ML/hky009
hky010	M	Street Hockey Player, Red Torso, Tan Legs	473	3.32999992	http://www.bricklink.com/ML/hky010
hol001	M	Caroler, Female	390	5.15999985	http://www.bricklink.com/ML/hol001
hol002	M	Caroler, Male	390	3.79999995	http://www.bricklink.com/ML/hol002
hol003	M	Santa, Dark Bluish Gray Legs	390	3.97000003	http://www.bricklink.com/ML/hol003
hol004	M	Santa, Glasses, D-Basket	390	4.5999999	http://www.bricklink.com/ML/hol004
hol005	M	Santa, Light Bluish Gray Legs	390	3.93000007	http://www.bricklink.com/ML/hol005
hol006	M	Santa, Light Gray Legs, D-Basket	390	4.5999999	http://www.bricklink.com/ML/hol006
hol007	M	Santa, Red Legs with Black Hips	390	3.94000006	http://www.bricklink.com/ML/hol007
hol008	M	Santa, Red Legs with White Hips	390	4.67999983	http://www.bricklink.com/ML/hol008
hol009	M	Santa, Red Legs with Red Hips	390	2.82999992	http://www.bricklink.com/ML/hol009
hol010	M	Santa, Yellow Legs with Black Hips, Yellow Torso	390	2.83999991	http://www.bricklink.com/ML/hol010
hol011	M	Santa, Dark Bluish Gray Legs, Backpack Open	390	4.75	http://www.bricklink.com/ML/hol011
hol012	M	Santa, Black Hips, Freckles (853353)	390	3.95000005	http://www.bricklink.com/ML/hol012
hol013	M	Santa, Red Legs, White Bushy Eyebrows	390	3.79999995	http://www.bricklink.com/ML/hol013
hol014	M	Santa, Red Legs with Red Hips, White Hands	390	3.75	http://www.bricklink.com/ML/hol014
hol015	M	Orange Halter Top with Medium Blue Trim and Flowers Pattern, Orange Legs, Dark Brown Hair Ponytail Long with Side Bangs	390	3.9000001	http://www.bricklink.com/ML/hol015
hol016	M	White Hoodie with Blue Pockets, Blue Legs, Lime Short Bill Cap	390	3.31999993	http://www.bricklink.com/ML/hol016
hol017	M	Sunset and Palm Trees - Blue Legs, Reddish Brown Male Hair	390	3.3499999	http://www.bricklink.com/ML/hol017
hor001	M	Horizontal Lines Red - White Arms - Blue Legs, Black Male Hair	67	3.3599999	http://www.bricklink.com/ML/hor001
hor002	M	Horizontal Lines Blue - Blue Arms - Blue Legs, Black Female Hair	67	3.32999992	http://www.bricklink.com/ML/hor002
hor003	M	Horizontal Lines Blue - Blue Arms - White Legs, Red Cap	67	3.36999989	http://www.bricklink.com/ML/hor003
hor004	M	Horizontal Lines Blue - White Arms - Blue Legs, Black Male Hair, White Arms	67	3.3599999	http://www.bricklink.com/ML/hor004
hor005	M	Horizontal Lines Red - Red Arms - Black Legs, Black Female Hair	67	3.32999992	http://www.bricklink.com/ML/hor005
hor006	M	Horizontal Lines Red - White Arms - Blue Legs, Brown Female Hair	67	3.32999992	http://www.bricklink.com/ML/hor006
hor007	M	Horizontal Lines Blue - White Arms - Blue Legs, Brown Female Hair	67	3.32999992	http://www.bricklink.com/ML/hor007
hor008	M	Horizontal Lines Blue - Blue Arms - Blue Legs, Blue Cap	67	3.36999989	http://www.bricklink.com/ML/hor008
hor009	M	Horizontal Lines Blue - Blue Arms - White Legs, Black Female Hair	67	3.32999992	http://www.bricklink.com/ML/hor009
hor010	M	Horizontal Lines Blue - White Arms - Blue Legs, Red Female Hair	67	3.32999992	http://www.bricklink.com/ML/hor010
hor011	M	Horizontal Lines Red - Red Arms - Red Legs, Red Cap	67	3.45000005	http://www.bricklink.com/ML/hor011
hor012	M	Horizontal Lines Red - White Arms - Black Legs, Black Male Hair	67	3.3599999	http://www.bricklink.com/ML/hor012
hor013	M	Horizontal Lines Red - Red Arms - White Legs, Black Male Hair	67	3.3599999	http://www.bricklink.com/ML/hor013
hor015	M	Horizontal Lines Red - Red Arms - Red Legs, Brown Female Hair	67	3.32999992	http://www.bricklink.com/ML/hor015
hor016	M	Horizontal Lines Red - Red Arms - Blue Legs, Black Hat	67	3.4000001	http://www.bricklink.com/ML/hor016
hor017	M	Horizontal Lines Blue - Blue Arms - White Legs, Brown Female Hair	67	3.32999992	http://www.bricklink.com/ML/hor017
hor018	M	Horizontal Lines Red - Red Arms - Light Gray Legs, Red Hat	67	3.4000001	http://www.bricklink.com/ML/hor018
hor019	M	Horizontal Lines Red - White Arms - Light Gray Legs, Brown Male Hair	67	3.3599999	http://www.bricklink.com/ML/hor019
hor020	M	Horizontal Lines Red - White Arms - Black Legs, Black Female Hair	67	3.32999992	http://www.bricklink.com/ML/hor020
hor021	M	Horizontal Lines Red - White Arms - Red Legs, Brown Female Hair	67	3.32999992	http://www.bricklink.com/ML/hor021
hor022	M	Horizontal Lines Red - Red Arms - White Legs, Black Ponytail Hair, Life Jacket	67	4.28000021	http://www.bricklink.com/ML/hor022
hor023	M	Horizontal Lines Blue - Blue Arms - White Legs, Blue Cap, Life Jacket	67	4.11000013	http://www.bricklink.com/ML/hor023
hor024	M	Horizontal Lines Red - White Arms - Red Legs, Red Ponytail Hair	67	3.56999993	http://www.bricklink.com/ML/hor024
hor025	M	Horizontal Lines Red - Red Arms - Blue Legs, Blue Cap	67	3.3499999	http://www.bricklink.com/ML/hor025
hor027	M	Horizontal Lines Red - White Arms - Blue Legs, Red Female Hair	67	3.32999992	http://www.bricklink.com/ML/hor027
hor028	M	Horizontal Lines Red - Red Arms - Blue Legs, Brown Male Hair	67	3.28999996	http://www.bricklink.com/ML/hor028
hor029	M	Horizontal Lines Red - White Arms - Red Legs, Black Female Hair	67	3.30999994	http://www.bricklink.com/ML/hor029
